{
  "metadata": {
    "domain": "org-structure",
    "version": "v2-org",
    "title": "Insurance Company Organizational Structure",
    "description": "Complete organizational hierarchy for InsureCorp Ltd., including divisions, departments, teams, positions, and people.",
    "rootUnitId": "OU_InsureCorp",
    "generatedAt": "2026-03-21T00:00:00Z"
  },
  "elements": {
    "nodes": [
      {
        "data": {
          "id": "OU_InsureCorp",
          "type": "org_unit",
          "name": "InsureCorp Ltd",
          "unitType": "company",
          "description": "Australian insurance company — life, health, general insurance"
        }
      },
      {
        "data": {
          "id": "OU_Underwriting",
          "type": "org_unit",
          "name": "Underwriting",
          "unitType": "division",
          "description": "Policy underwriting and risk selection"
        }
      },
      {
        "data": {
          "id": "OU_UW_Life",
          "type": "org_unit",
          "name": "Life & IP",
          "unitType": "department",
          "description": "Life insurance and income protection underwriting"
        }
      },
      {
        "data": {
          "id": "OU_UW_General",
          "type": "org_unit",
          "name": "General Insurance",
          "unitType": "department",
          "description": "Motor, Home, Travel, Pet insurance underwriting"
        }
      },
      {
        "data": {
          "id": "OU_UW_Life_Team",
          "type": "org_unit",
          "name": "Life Underwriting Team",
          "unitType": "team",
          "description": "Senior underwriters — life risk assessment"
        }
      },
      {
        "data": {
          "id": "OU_UW_IP_Team",
          "type": "org_unit",
          "name": "Income Protection Team",
          "unitType": "team",
          "description": "IP underwriting and occupational assessment"
        }
      },
      {
        "data": {
          "id": "OU_UW_Motor_Team",
          "type": "org_unit",
          "name": "Motor Insurance Team",
          "unitType": "team",
          "description": "Auto/motor vehicle underwriting"
        }
      },
      {
        "data": {
          "id": "OU_UW_Home_Team",
          "type": "org_unit",
          "name": "Home & Property Team",
          "unitType": "team",
          "description": "Home and landlord insurance underwriting"
        }
      },
      {
        "data": {
          "id": "OU_UW_Specialty",
          "type": "org_unit",
          "name": "Specialty & Commercial",
          "unitType": "team",
          "description": "Commercial and specialty insurance underwriting"
        }
      },
      {
        "data": {
          "id": "OU_Claims",
          "type": "org_unit",
          "name": "Claims",
          "unitType": "division",
          "description": "Claims management and settlement"
        }
      },
      {
        "data": {
          "id": "OU_Claims_Life",
          "type": "org_unit",
          "name": "Life Claims",
          "unitType": "department",
          "description": "Life insurance claims processing"
        }
      },
      {
        "data": {
          "id": "OU_Claims_General",
          "type": "org_unit",
          "name": "General Claims",
          "unitType": "department",
          "description": "Non-life insurance claims"
        }
      },
      {
        "data": {
          "id": "OU_Claims_Life_Team",
          "type": "org_unit",
          "name": "Life Claims Assessment",
          "unitType": "team",
          "description": "Death, TPD, and critical illness claims"
        }
      },
      {
        "data": {
          "id": "OU_Claims_IP_Team",
          "type": "org_unit",
          "name": "Income Protection Claims",
          "unitType": "team",
          "description": "IP claim assessment and management"
        }
      },
      {
        "data": {
          "id": "OU_Claims_Motor_Team",
          "type": "org_unit",
          "name": "Motor Claims",
          "unitType": "team",
          "description": "Motor vehicle accident claims"
        }
      },
      {
        "data": {
          "id": "OU_Claims_Home_Team",
          "type": "org_unit",
          "name": "Home Claims",
          "unitType": "team",
          "description": "Home and property claims"
        }
      },
      {
        "data": {
          "id": "OU_Claims_Fraud",
          "type": "org_unit",
          "name": "Fraud & Investigations",
          "unitType": "team",
          "description": "Claims fraud detection and investigation"
        }
      },
      {
        "data": {
          "id": "OU_Operations",
          "type": "org_unit",
          "name": "Operations",
          "unitType": "division",
          "description": "Customer service, administration, distribution"
        }
      },
      {
        "data": {
          "id": "OU_Ops_Customer",
          "type": "org_unit",
          "name": "Customer Operations",
          "unitType": "department",
          "description": "Contact center and customer support"
        }
      },
      {
        "data": {
          "id": "OU_Ops_Admin",
          "type": "org_unit",
          "name": "Administrative Services",
          "unitType": "department",
          "description": "Policy administration and processing"
        }
      },
      {
        "data": {
          "id": "OU_Ops_Digital",
          "type": "org_unit",
          "name": "Digital & Distribution",
          "unitType": "department",
          "description": "Online platforms, brokers, partnerships"
        }
      },
      {
        "data": {
          "id": "OU_Finance",
          "type": "org_unit",
          "name": "Finance & Treasury",
          "unitType": "division",
          "description": "Financial management, accounting, investments"
        }
      },
      {
        "data": {
          "id": "OU_Fin_Accounting",
          "type": "org_unit",
          "name": "Accounting & Reporting",
          "unitType": "department",
          "description": "General ledger, APRA reporting, audit"
        }
      },
      {
        "data": {
          "id": "OU_Fin_Treasury",
          "type": "org_unit",
          "name": "Treasury & Investments",
          "unitType": "department",
          "description": "Cash management, investment strategy"
        }
      },
      {
        "data": {
          "id": "OU_Fin_Planning",
          "type": "org_unit",
          "name": "FP&A",
          "unitType": "department",
          "description": "Financial planning and analysis"
        }
      },
      {
        "data": {
          "id": "OU_Risk",
          "type": "org_unit",
          "name": "Risk & Compliance",
          "unitType": "division",
          "description": "Risk management, regulatory compliance"
        }
      },
      {
        "data": {
          "id": "OU_Risk_Management",
          "type": "org_unit",
          "name": "Risk Management",
          "unitType": "department",
          "description": "Enterprise risk, insurance risk modeling"
        }
      },
      {
        "data": {
          "id": "OU_Compliance",
          "type": "org_unit",
          "name": "Compliance & Legal",
          "unitType": "department",
          "description": "Regulatory compliance, legal, AML/KYC"
        }
      },
      {
        "data": {
          "id": "OU_Actuarial",
          "type": "org_unit",
          "name": "Actuarial",
          "unitType": "division",
          "description": "Actuarial analysis, pricing, reserving"
        }
      },
      {
        "data": {
          "id": "OU_Act_Pricing",
          "type": "org_unit",
          "name": "Pricing & Modeling",
          "unitType": "team",
          "description": "Premium calculation, pricing models"
        }
      },
      {
        "data": {
          "id": "OU_Act_Reserve",
          "type": "org_unit",
          "name": "Reserving & Valuations",
          "unitType": "team",
          "description": "Liability reserves, policy valuation"
        }
      },
      {
        "data": {
          "id": "OU_Act_Experience",
          "type": "org_unit",
          "name": "Experience Analysis",
          "unitType": "team",
          "description": "Actual vs expected analysis, assumption review"
        }
      },
      {
        "data": {
          "id": "OU_Technology",
          "type": "org_unit",
          "name": "Technology",
          "unitType": "division",
          "description": "IT, data, systems, digital transformation"
        }
      },
      {
        "data": {
          "id": "OU_Tech_CoreSystems",
          "type": "org_unit",
          "name": "Core Systems",
          "unitType": "department",
          "description": "Policy admin, claims, billing systems"
        }
      },
      {
        "data": {
          "id": "OU_Tech_Data",
          "type": "org_unit",
          "name": "Data & Analytics",
          "unitType": "department",
          "description": "Data warehouse, BI, data science"
        }
      },
      {
        "data": {
          "id": "OU_Tech_Infrastructure",
          "type": "org_unit",
          "name": "Infrastructure & Security",
          "unitType": "department",
          "description": "Cloud, infrastructure, cybersecurity"
        }
      },
      {
        "data": {
          "id": "P_CEO",
          "type": "position",
          "title": "Chief Executive Officer",
          "level": "C-Level",
          "vacancyStatus": "filled",
          "costCenter": "EXEC"
        }
      },
      {
        "data": {
          "id": "P_CFO",
          "type": "position",